{
  "scope": "Linux,Containers,Kubernetes scenarios,Network Devices",
  "runtime": [
    "audit.py",
    "inventory_scan.py",
    "extract_evidence.py",
    "parse_rules.py",
    "condition_ast_parser.py",
    "condition_ast_enricher.py",
    "build_scope_lock.py",
    "data_component_alias.py",
    "infer_intent.py",
    "scenario_model_lint.py",
    "scenario_attack_id_health.py",
    "build_depth_gap_backlog.py",
    "format_lint.py",
    "validate_declared_tags.py",
    "field_chain_analyzer.py",
    "compute_coverage.py",
    "fixture_ingest.py",
    "fixture_chain_validator.py",
    "denominator_guard.py",
    "bypass_analyzer.py",
    "behavior_primitive_matrix.py",
    "subtechnique_gap.py",
    "attack_strategy_alignment.py",
    "test_gap_analyzer.py",
    "test_vector_plan.py",
    "coverage_gate.py",
    "attack_path_matrix.py",
    "bypass_fixture_binder.py",
    "data_component_gate.py",
    "denominator_diff.py",
    "coverage_gate_v8.py",
    "attack_claim_falsifier.py",
    "coverage_claim_upgrader.py",
    "denominator_proof_graph.py",
    "attack_claim_failure_model.py",
    "bypass_cutset_analyzer.py",
    "data_component_minset.py",
    "coverage_score_v9.py",
    "runtime_sensor_context.py",
    "field_chain_proof_graph.py",
    "coverage_final_gate_v10.py",
    "remediation_advisor.py",
    "patch_blueprint.py",
    "field_preservation_test_generator.py",
    "minimal_fixture_suite.py",
    "validate_report.py"
  ],
  "maintenance": [
    "build_attack_index.py",
    "build_network_alias_pack.py",
    "build_uncovered_attack_scope.py",
    "network_device_extension.py",
    "analyze_quality_strict.py",
    "enterprise_coverage_review.py",
    "script_dependency_check.py",
    "scope_hash_diff.py",
    "retention_manager.py",
    "package_check.py",
    "cache_status.py",
    "clean_runtime_cache.py",
    "audit_dag.py",
    "subtechnique_resolver.py",
    "compare_rule_packages.py",
    "verify.py"
  ],
  "utility": [
    "common.py",
    "attack_lookup.py",
    "attack_json_slice.py",
    "init_workspace.py",
    "export_audit_package.py",
    "ab_resilience_compare.py"
  ],
  "archived": [
    "laji/scripts/archived_nonruntime_model_generators_20260611_090340/apply_wave2_expansion.py",
    "laji/scripts/archived_nonruntime_model_generators_20260611_090340/sync_scenario_model_v10_2.py",
    "laji/scripts/archived_nonruntime_model_generators_20260611_090340/wave3_deep_enrichment.py",
    "laji/scripts/archived_nonruntime_model_generators_20260611_090340/wave4_depth_closure.py",
    "laji/scripts/archived_nonruntime_model_generators_20260611_090340/wave5_medium_quality_enrichment.py",
    "laji/scripts/archived_nonruntime_model_generators_20260611_090340/coverage_gate_v7.py"
  ],
  "experimental": []
}
